Norma,Descricao da Sigla,Data de Apresentacao,Autor,Partido,Ementa,Similaridade Semantica,Link Documento PDF,Link Página Web,Indexacao,Último Estado,Data Último Estado,Situação
PL 3391/2023,Projeto de Lei,2023-07-05,Márcio Honaiser,PDT,"Altera a Lei nº 13.146, de 6 de julho de 2015, estabelecendo parâmetros de acessibilidade para a realização de videoconferências na internet.",0.490,https://www.camara.leg.br/proposicoesWeb/prop_mostrarintegra?codteor=2296760,https://dadosabertos.camara.leg.br/api/v2/proposicoes/2372639,"Alteração, Estatuto da Pessoa com Deficiência (2015), criação, parâmetro, Acessibilidade, Pessoa com deficiência, Videoconferência, Transmissão ao vivo, Internet, Provedor de acesso, Provedor de aplicações.",Notificações,2025-06-11,Tramitando em Conjunto
PL 1912/2023,Projeto de Lei,2023-04-14,Carol Dartora,PT,"Altera a Lei nº 12.965, de 23 de abril de 2014, para dispor sobre a garantia da responsabilização ulterior de usuários da internet, respeitada a liberdade de pensamento e de expressão, em conformidade com o artigo 13, da Convenção Americana sobre Direitos Humanos, Decreto nº 678, de 06 de novembro de 1992.",0.473,https://www.camara.leg.br/proposicoesWeb/prop_mostrarintegra?codteor=2259044,https://dadosabertos.camara.leg.br/api/v2/proposicoes/2356488,"Alteração, Marco Civil da Internet, garantia, responsabilização, posterioridade, usuário, internet, respeito, Liberdade de pensamento, Liberdade de expressão. _Proibição, censura prévia, garantia, responsabilidade, posterioridade, identificação, manifestação, vídeo, imagem, incitação à violência, discriminação racial, discurso de ódio, intolerância, convicção política, disseminação, notícia falsa (fake news), produção, venda, pornografia infantil. _Providências, provedor de acesso, rede social, Sítio (internet), recebimento, denúncia, solicitação, bloqueio, conteúdo digital.",Encerramento de Prazo,2024-05-28,Aguardando Parecer
PL 2483/2023,Projeto de Lei,2023-05-10,Amom Mandel,CIDADANIA,"Altera a Lei nº 11.638, de 28 de dezembro de 2007, para dispor sobre a publicação na rede mundial de computadores (internet) de demonstrações financeiras de sociedades de grande porte.",0.473,https://www.camara.leg.br/proposicoesWeb/prop_mostrarintegra?codteor=2270741,https://dadosabertos.camara.leg.br/api/v2/proposicoes/2361488,"Alteração, Lei Federal, divulgação, internet, demonstração contábil, Sociedade de grande porte.",Publicação de Proposição,2025-05-30,Aguardando Designação de Relator(a)
PL 5191/2023,Projeto de Lei,2023-10-25,Vinicius Carvalho,REPUBLICANOS,"Altera a Lei nº 13.812, de 16 de março de 2019, para determinar a disponibilização e divulgação, de informações sobre pessoas desaparecidas na internet, nos diversos meios de comunicação e em operadoras de telefonia celular e empresas de tecnologia proprietárias de redes sociais e serviços de mensagens instantâneas, de informações que contenham informações das pessoas desaparecidas.",0.470,https://www.camara.leg.br/proposicoesWeb/prop_mostrarintegra?codteor=2350930,https://dadosabertos.camara.leg.br/api/v2/proposicoes/2399394,"Alteração, Lei Federal, Política Nacional de Busca de Pessoas Desaparecidas, Poder Público, convênio, Operadora de telefonia móvel, Provedor de aplicação de mensagem instantânea, rede social, divulgação, informação, pessoa desaparecida. _ Alteração, Estatuto da Criança e do Adolescente (ECA) (1990), serviços, localização, criança, adolescente, pessoa desaparecida, cooperação, Emissora de radiodifusão, televisão, Operadora de telefonia móvel, Provedor de aplicação de mensagem instantânea, rede social.",Publicação de Proposição,2023-10-31,Tramitando em Conjunto
PL 791/2023,Projeto de Lei,2023-03-02,Emanuel Pinheiro Neto,MDB,"Estabelece procedimentos a serem adotados pela União em regime de colaboração com os Estados, Distrito Federal e Municípios em situação de riscos e desastres mediante o uso de Sistemas de Processamento de Dados e de Inteligência Artificial (IA), com objetivo na organização, solução e implementação integrada e da outras providências.",0.468,https://www.camara.leg.br/proposicoesWeb/prop_mostrarintegra?codteor=2238986,https://dadosabertos.camara.leg.br/api/v2/proposicoes/2349820,"Colaboração, União, Estado (ente federado), Distrito Federal (Brasil), Município, Sistema computacional, Processamento de Dados, Inteligência artificial, Situação de risco, desastre ambiental, Desastre humano, prevenção, fiscalização, desmatamento, exploração florestal, proteção ambiental, diretrizes.",Designação de Relator(a),2025-06-02,Aguardando Parecer
PL 1367/2023,Projeto de Lei,2023-03-23,Marco Brasil,PP,"Institui o Programa Digitaliza Brasil, com o objetivo de promover a inclusão digital da população brasileira por meio de campanhas intensivas de cidadania digital, oficinas de estímulo à inclusão digital e capacitação de profissionais da Rede Pública.",0.459,https://www.camara.leg.br/proposicoesWeb/prop_mostrarintegra?codteor=2248324,https://dadosabertos.camara.leg.br/api/v2/proposicoes/2353022,"Criação, Programa Digitaliza Brasil, finalidade, inclusão digital, população, acompanhamento, campanha educativa, cidadania, oficina de trabalho, capacitação, profissional, rede pública de ensino.",Notificacao para Publicação Intermediária,2025-04-15,Tramitando em Conjunto
PL 3254/2023,Projeto de Lei,2023-06-26,Juninho do Pneu,UNIÃO,Dispõe sobre o envio automático dos protocolos por e-mail pelos prestadores de serviço de telemarketing.,0.456,https://www.camara.leg.br/proposicoesWeb/prop_mostrarintegra?codteor=2293339,https://dadosabertos.camara.leg.br/api/v2/proposicoes/2371468,"Obrigatoriedade, Operadora de telefonia móvel, criação, Protocolo de atendimento, Atendimento ao consumidor, remessa, Correio eletrônico, Consumidor, Usuário de serviços.",Publicação de Proposição,2023-08-02,Tramitando em Conjunto
PL 4999/2023,Projeto de Lei,2023-10-16,Filipe Martins,PL,"Altera a Lei nº 12.965, de 23 de abril de 2014 – Marco Civil da Internet, para dispor sobre obrigatoriedade de sistemas de verificação de idade em sites de apostas esportivas e de venda de conteúdos adultos, nos termos que especifica.",0.455,https://www.camara.leg.br/proposicoesWeb/prop_mostrarintegra?codteor=2344970,https://dadosabertos.camara.leg.br/api/v2/proposicoes/2395981,"Alteração, Marco Civil da Internet (2014), obrigatoriedade, Sítio (internet), aposta esportiva, conteúdo impróprio, Medida de segurança, verificação, idade, usuário.",Notificações,2025-06-09,Tramitando em Conjunto
PL 3706/2023,Projeto de Lei,2023-08-02,Jones Moura,PSD,"Altera dispositivos da Lei nº 11.096, de 13 de janeiro de 2005, para garantir acesso à Universidade, através do PROUNI, aos profissionais de Segurança Pública e seus dependentes.",0.453,https://www.camara.leg.br/proposicoesWeb/prop_mostrarintegra?codteor=2305028,https://dadosabertos.camara.leg.br/api/v2/proposicoes/2375383,"Alteração, Lei do Programa Universidade para Todos (2005), garantia, acesso, Programa Universidade para Todos (ProUni), graduação, profissional da segurança pública, Sistema Único de Segurança Pública (Susp), agente socioeducativo, dependente, critério, classificação.",Notificações,2023-12-20,Tramitando em Conjunto
PL 5013/2023,Projeto de Lei,2023-10-17,Priscila Costa,PL,"Dispõe sobre o banimento de contas e domínios que promovam o aborto por meio de sites, aplicativos e plataformas online, e dá outras providências.",0.452,https://www.camara.leg.br/proposicoesWeb/prop_mostrarintegra?codteor=2345297,https://dadosabertos.camara.leg.br/api/v2/proposicoes/2396152,"Exclusão, conta de usuário, domínio (internet), promoção, aborto, intermediação, Sítio (internet), plataforma digital. _Empresa, gestor, plataforma digital, adoção, meios, identificação, conta de usuário, domínio (internet), promoção, aborto, comunicação, autoridade policial, atividade ilícita. _Penalidade, descumprimento, prática. _Informação, coleta, identificação, atividade ilícita, tratamento, sigilo, proteção, dados pessoais.",Saída de Relator(a) da Comissão - Sem Parecer Apresentado,2025-03-19,Aguardando Designação - Aguardando Devolução de Relator(a) que deixou de ser Membro
