Norma;Descricao da Sigla;Data de Apresentacao;Autor;Partido;Ementa;Link Documento PDF;Link Página Web;Indexacao;Último Estado;Data Último Estado;Situação;Score Final;Boost Keyword;Similaridade Semantica
PL 1002/2015;Projeto de Lei;2015-03-31;Fabiano Horta;PT;Altera a Lei nº 9.503, de 23 de setembro de 1997, que institui o Código de Trânsito Brasileiro, para criar o cadastro positivo de condutores de veículos automotores.;https://www.camara.leg.br/proposicoesWeb/prop_mostrarintegra?codteor=1316133;https://www.camara.leg.br/proposicoesWeb/fichadetramitacao?idProposicao=1197822;Alteração, Código de Trânsito Brasileiro, criação. atualização, cadastro positivo, motorista, dados, infração de trânsito.;Notificação de Apensação;2019-04-01;Tramitando em Conjunto;0.4349;PARCIAL (1 Termo);0.4187
PL 2101/2023;Projeto de Lei;2023-04-24;Eli Borges;PL;Altera o Código de Trânsito      b b    Brasileiro para prever que somente serão aplicadas multas a veículos em rodovias que apresentem sinalização e conservação adequadas.;https://www.camara.leg.br/proposicoesWeb/prop_mostrarintegra?codteor=2262756;https://www.camara.leg.br/proposicoesWeb/fichadetramitacao?idProposicao=2357924;Alteração, Código de Trânsito Brasileiro, aplicação, multa, veículo, via terrestre, rodovia, exclusividade, estrada, sinalização, conservação, adequação.;Arquivamento;2024-09-09;Arquivada;0.4349;PARCIAL (1 Termo);0.4186
PL 6656/2016;Projeto de Lei;2016-12-07;Felipe Bornier;PROS;Obriga a disponibilização digital dos documentos de uso e porte obrigatório pelos condutores habilitados de veículos.;https://www.camara.leg.br/proposicoesWeb/prop_mostrarintegra?codteor=1515424;https://www.camara.leg.br/proposicoesWeb/fichadetramitacao?idProposicao=2120405;Alteração, Código de Trânsito Brasileiro, facultatividade, condutor, veículo, documento digital, Certificado de Registro de Veículo (CRV) , Certificado de Licenciamento Anual, Carteira Nacional de Habilitação (CNH).;Devolução à CCP;2019-11-29;Arquivada;0.4348;PARCIAL (1 Termo);0.4186
PL 6353/2019;Projeto de Lei;2019-12-10;Luis Miranda;REPUBLICANOS;"Altera o art. 320 da Lei nº 9.503, de 23 de setembro de 1997, que ""institui o Código de Trânsito Brasileiro"", para assegurar a destinação de parcela da receita arrecadada com a cobrança de multas de trânsito à manutenção de rodovias e à educação de trânsito.";https://www.camara.leg.br/proposicoesWeb/prop_mostrarintegra?codteor=1844203;https://www.camara.leg.br/proposicoesWeb/fichadetramitacao?idProposicao=2233136;Alteração, Código de Trânsito Brasileiro, percentual, recursos, multa de trânsito, Educação para o trânsito, Engenharia de tráfego, manutenção, rodovia.;Publicação de Proposição;2019-12-18;Tramitando em Conjunto;0.4343;PARCIAL (1 Termo);0.4179
PL 1355/2019;Projeto de Lei;2019-03-12;Célio Studart;PSD;Altera a Lei nº 12.587, de 3 de janeiro de 2012, que institui as diretrizes da Política Nacional de Mobilidade Urbana, para prever a necessidade de justificativa das sanções impostas pelos aplicativos de transporte privado de passageiros aos seus motoristas e usuários;https://www.camara.leg.br/proposicoesWeb/prop_mostrarintegra?codteor=1717859;https://www.camara.leg.br/proposicoesWeb/fichadetramitacao?idProposicao=2193603;Alteração, Lei da Política Nacional de Mobilidade Urbana, Aplicativo Uber, Aplicativo Cabify, transporte privado, Transporte de passageiro, obrigatoriedade, justificativa, sanção, motorista, Passageiro.;Devolução ao(à) Relator(a);2025-10-15;Aguardando Parecer;0.4343;NAO;0.5428
PL 6658/2025;Projeto de Lei;2025-12-22;Amom Mandel;CIDADANIA;Altera a Lei nº 12.587, de 3 de janeiro de 2012 (Política Nacional de Mobilidade Urbana), para garantir a segurança contra a violência de gênero no transporte público.;https://www.camara.leg.br/proposicoesWeb/prop_mostrarintegra?codteor=3071684;https://www.camara.leg.br/proposicoesWeb/fichadetramitacao?idProposicao=2599035;Alteração, Lei da Política Nacional de Mobilidade Urbana (2012), enfrentamento, Violência de gênero, prevenção, Assédio sexual, Transporte público coletivo, mulher.;Recebimento;2026-02-23;Aguardando Designação de Relator(a);0.4339;NAO;0.5424
PLP 96/2024;Projeto de Lei Complementar;2024-05-21;Bruno Ganem;PODE;Altera a Lei Complementar n.º 207, de 17 de maio de 2024, que dispõe sobre o Seguro Obrigatório para Proteção de Vítimas de Acidentes de Trânsito (SPVAT), para que a sua contratação seja de caráter opcional para os proprietários de veículos automotores.;https://www.camara.leg.br/proposicoesWeb/prop_mostrarintegra?codteor=2426564;https://www.camara.leg.br/proposicoesWeb/fichadetramitacao?idProposicao=2435132;Alteração, lei complementar, Lei Orgânica da Seguridade Social (1991), Código de Trânsito Brasileiro (1997), revogação, obrigatoriedade, Seguro Obrigatório para Proteção de Vítimas de Acidentes de Trânsito (SPVAT), proprietário, veículo automotor, contratação opcional, seguro.;Expedição de Documento;2024-08-28;Aguardando Parecer;0.4338;PARCIAL (1 Termo);0.4173
PL 1435/2015;Projeto de Lei;2015-05-07;Marcelo Belinati;PP;Acrescenta o § 6º ao art. 147 da Lei nº 9.503, de 23 de setembro de 1997, que instituiu o Código de Trânsito Brasileiro, para dispor sobre isenção de taxa de renovação de CNH para motorista de táxi.;https://www.camara.leg.br/proposicoesWeb/prop_mostrarintegra?codteor=1330571;https://www.camara.leg.br/proposicoesWeb/fichadetramitacao?idProposicao=1230110;Alteração, Código de Trânsito Brasileiro, isenção, taxa, emolumento, renovação, Carteira Nacional de Habilitação (CNH), motorista, táxi.;Desarquivamento a Pedido;2019-02-26;Tramitando em Conjunto;0.4338;PARCIAL (1 Termo);0.4172
PL 5267/2016;Projeto de Lei;2016-05-12;Hildo Rocha;MDB;Dispõe sobre a inclusão das permissionárias do transporte público coletivo alternativo urbano de passageiros no Programa de Infraestrutura de Transporte e da Mobilidade Urbana - Pró- Transporte, que atua no âmbito da Política Nacional de Desenvolvimento Urbano e da Política Setorial de Transporte e da Mobilidade Urbana.;https://www.camara.leg.br/proposicoesWeb/prop_mostrarintegra?codteor=1457238;https://www.camara.leg.br/proposicoesWeb/fichadetramitacao?idProposicao=2084318;Inclusão, permissionária (administração pública), transporte público coletivo, transporte alternativo, Programa de Infraestrutura de Transporte e da Mobilidade Urbana (Pró-Transporte), ampliação, infraestrutura, transporte público, acessibilidade, mobilidade urbana.;Arquivamento;2019-06-26;Arquivada;0.4338;NAO;0.5422
PL 833/2024;Projeto de Lei;2024-03-19;Dr Fabio Rueda;UNIÃO;Dispõe sobre a gratuidade do transporte público coletivo para as pessoas portadoras de doenças graves.;https://www.camara.leg.br/proposicoesWeb/prop_mostrarintegra?codteor=2396639;https://www.camara.leg.br/proposicoesWeb/fichadetramitacao?idProposicao=2421735;Diretrizes, gratuidade, transporte público coletivo, pessoa com doença grave, pessoa com deficiência, consulta médica, exame médico, cirurgia, comprovante, agendamento, procedimento médico.;Publicação de Proposição;2024-03-25;Tramitando em Conjunto;0.4338;NAO;0.5422
PL 2663/2022;Projeto de Lei;2022-10-24;Daniel Almeida;PCdoB;Torna obrigatória a gratuidade do transporte público coletivo de passageiros nos dias de eleição, em todos os turnos, e nos dias de plebiscito ou referendo, e dá outras providências.;https://www.camara.leg.br/proposicoesWeb/prop_mostrarintegra?codteor=2211269;https://www.camara.leg.br/proposicoesWeb/fichadetramitacao?idProposicao=2336173;Obrigatoriedade, Poder público, estado (ente federado), município, Concessionária (administração pública), transporte público coletivo, passageiro, oferecimento, transporte gratuito, dia, Eleição, Plebiscito, Referendo, criação, linha de ônibus, região geográfica, distância.;Notificações;2024-05-29;Tramitando em Conjunto;0.4337;NAO;0.5422
PL 9842/2018;Projeto de Lei;2018-03-21;André Amaral;PROS;Altera o art. 320 da Lei nº 9.503, de 1997, que institui o Código de Trânsito Brasileiro, para dispor sobre a destinação dos recursos arrecadados com multas de trânsito.;https://www.camara.leg.br/proposicoesWeb/prop_mostrarintegra?codteor=1646320;https://www.camara.leg.br/proposicoesWeb/fichadetramitacao?idProposicao=2169837;Alteração, Código de Trânsito Brasileiro, inclusão, pavimentação asfáltica, via terrestre,   recursos, multa de trânsito.;Desarquivamento a Pedido;2019-02-26;Tramitando em Conjunto;0.4332;PARCIAL (1 Termo);0.4165
PL 2632/2015;Projeto de Lei;2015-08-13;Alberto Fraga;PL;Regulamenta o transporte privado individual de passageiros e dá outras providências.;https://www.camara.leg.br/proposicoesWeb/prop_mostrarintegra?codteor=1370863;https://www.camara.leg.br/proposicoesWeb/fichadetramitacao?idProposicao=1633181;Regulamentação, transporte individual, transporte de passageiro,  prestação de serviços, trabalhador autônomo, modalidade, Aplicativo Uber.;Notificações;2016-11-08;Retirado pelo(a) Autor(a);0.4331;NAO;0.5414
PL 1260/2020;Projeto de Lei;2020-03-30;Pompeo de Mattos;PDT;Estabelece em caráter excepcional a suspensão da cobrança de pedágios nas rodovias federais para as empresas transportadoras de mercadorias e bens, os transportadores autônomos, as empresas de transporte de passageiros e as empresas de turismo.;https://www.camara.leg.br/proposicoesWeb/prop_mostrarintegra?codteor=1871633;https://www.camara.leg.br/proposicoesWeb/fichadetramitacao?idProposicao=2242376;Suspensão, caráter temporário, pedágio, rodovia federal, transporte de carga, transporte de passageiro, turismo, pandemia, coronavírus..;Notificacao para Publicação Intermediária;2026-02-24;Tramitando em Conjunto;0.4331;NAO;0.5413
PL 3656/2019;Projeto de Lei;2019-06-19;Diego Andrade;PSD;Altera a Lei nº 9.503, de 23 de setembro de 1997, que institui o Código de Trânsito Brasileiro, para promover a obrigatoriedade da instalação de sistema de monitoramento eletrônico nas rodovias federais, como medida de fiscalização e de policiamento ostensivo de trânsito.;https://www.camara.leg.br/proposicoesWeb/prop_mostrarintegra?codteor=1767142;https://www.camara.leg.br/proposicoesWeb/fichadetramitacao?idProposicao=2208820;Alteração, Código de Trânsito Brasileiro, Obrigatoriedade, Câmera de segurança, Posto de fiscalização de trânsito, rodovia federal, competência, Polícia Rodoviária Federal, Policiamento ostensivo, trânsito, combate, infração penal.;Publicação de Proposição;2019-07-15;Tramitando em Conjunto;0.4329;PARCIAL (1 Termo);0.4161
PL 1888/2015;Projeto de Lei;2015-06-11;Danrlei de Deus Hinterholz;PSD;"Acrescenta §2º ao art. 140 da Lei nº 9.503, de 23 de setembro de 1997, que ""Institui o Código de Trânsito Brasileiro"", para obrigar os Estados e o Distrito Federal a criarem Centros de Formação de Condutores destinados às pessoas com deficiência em veículos adaptados.";https://www.camara.leg.br/proposicoesWeb/prop_mostrarintegra?codteor=1347540;https://www.camara.leg.br/proposicoesWeb/fichadetramitacao?idProposicao=1306947;Alteração, Código de Trânsito Brasileiro, obrigatoriedade, criação, Centro de Formação de Condutores, pessoa com deficiência, veículo adaptado, Estado, Distrito Federal (Brasil).;Desarquivamento a Pedido;2019-02-26;Tramitando em Conjunto;0.4326;PARCIAL (1 Termo);0.4157
PL 3407/2021;Projeto de Lei;2021-10-01;Eduardo Bismarck;PDT;Altera a Lei nº 9.503, de 23 de setembro de 1997, que institui o Código de Trânsito Brasileiro, para prever a renovação automática da autorização de transporte de passageiros em veículo de carga ou misto em caso de não implantação de serviço regular de transporte.;https://www.camara.leg.br/proposicoesWeb/prop_mostrarintegra?codteor=2083572;https://www.camara.leg.br/proposicoesWeb/fichadetramitacao?idProposicao=2301279;Alteração, Código de Trânsito Brasileiro, critério, renovação, autorização, transporte de passageiro, Veículo de carga, Veículo misto.;Publicação de Proposição;2021-11-24;Tramitando em Conjunto;0.4323;PARCIAL (1 Termo);0.4154
PL 3574/2024;Projeto de Lei;2024-09-16;Gilvan Maximo;REPUBLICANOS;Altera a Lei nº 9.503, de 1997, que institui o Código de Trânsito Brasileiro, para agravar as penalidades aos condutores que dirigirem sob influência de álcool.;https://www.camara.leg.br/proposicoesWeb/prop_mostrarintegra?codteor=2477259;https://www.camara.leg.br/proposicoesWeb/fichadetramitacao?idProposicao=2458369;Alteração, Código de Trânsito Brasileiro (1997), infração de trânsito, agravação penal, condução sob efeito de álcool, condução sob efeito de substância psicoativa, cassação, Carteira Nacional de Habilitação (CNH), suspensão, direito de dirigir, contagem de prazo, vítima, lesão corporal culposa, falecimento, responsabilização, condutor, aumento, penalidade, multa, despesa médica, indenização.;Notificação de Apensação;2025-05-06;Aguardando Parecer;0.4322;PARCIAL (1 Termo);0.4153
PL 4877/2019;Projeto de Lei;2019-09-04;Bira do Pindaré;PSB;"Dispõe sobre a obrigatoriedade de implantação de ciclovias/ciclofaixas pelo Poder Público ou empresas concessionárias/privadas em obras e serviços de engenharia, nas intervenções viárias metropolitanas, e de paraciclos e bicicletários em terminais rodoviários, estações metroferroviárias, instalações portuárias, espaços públicos e privados de trabalho, ensino, comércio e lazer, assim como dá nova redação a Lei nº 8.666 de 21 de junho de 1993 que ""Institui normas para licitações e contratos da Administração Pública"", a Lei nº 9.503, de 23 de setembro de 1997 que ""Institui o Código de Trânsito Brasileiro"", a Lei nº 12.587, de 3 de janeiro de 2012 que ""Institui as diretrizes da Política Nacional do Mobilidade Urbana"", a Lei nº 10.257, de 10 de julho de 2001 que ""Estabelece diretrizes gerais da política urbana - Estatuto das Cidades"", a Lei nº 11.977 de 7 de julho de 2009 que "" Dispõe sobre o Programa Minha Casa, Minha Vida - PMCMV e a regularização fundiária de assentamentos localizados em áreas urbanas, e dá outras providências";https://www.camara.leg.br/proposicoesWeb/prop_mostrarintegra?codteor=1802366;https://www.camara.leg.br/proposicoesWeb/fichadetramitacao?idProposicao=2218687;"Alteração, Lei de Licitação, edital, licitação, obra pública, serviços de engenharia, obra viária, obrigatoriedade, ciclovia, ciclofaixa, infraestrutura cicloviária. 
_Alteração, Código de Trânsito Brasileiro, infraestrutura cicloviária, 
 Bicicleta, Equipamento de mobilidade individual autopropelido, via pública, infração de trânsito. 
_ Alteração, Lei da Política Nacional de Mobilidade urbana, obra pública, serviços de engenharia, terminal de passageiros (TPS), estação rodoviária, metrô, obrigatoriedade, infraestrutura cicloviária, Equipamento de mobilidade individual autopropelido, bicicleta. 
_ Alteração, Estatuto da Cidade, plano diretor, previsão, infraestrutura cicloviária, bicicleta, 
Equipamento de mobilidade individual autopropelido. 
_ Alteração, Lei do Programa Minha Casa, Minha Vida (PMCMV). Programa Minha Casa, Minha Vida (PMCMV), infraestrutura cicloviária, 
 Bicicleta, Equipamento de mobilidade individual autopropelido, Mobilidade sustentável.";Publicação de Proposição;2019-09-16;Tramitando em Conjunto;0.4321;PARCIAL (1 Termo);0.4151
PL 2919/2023;Projeto de Lei;2023-06-02;Zé Neto;PT;Altera a Lei nº 9.503, de 23 de setembro de 1997, que institui o Código de Trânsito Brasileiro, para dispor sobre a exclusividade dos CFC’s para o processo de formação de condutores de veículos automotores.;https://www.camara.leg.br/proposicoesWeb/prop_mostrarintegra?codteor=2283370;https://www.camara.leg.br/proposicoesWeb/fichadetramitacao?idProposicao=2367049;Alteração, Código de Trânsito Brasileiro (1997), exclusividade, Centro de Formação de Condutores (CFC), Habilitação, Formação de condutor, Veículo automotor, obrigatoriedade, Educação para o trânsito.;Apresentação de Requerimento;2024-03-22;Tramitando em Conjunto;0.4317;PARCIAL (1 Termo);0.4147
PL 5153/2016;Projeto de Lei;2016-05-04;Francisco Floriano;DEM;"""Altera a Lei nº 12.587, de 03 de janeiro de 2012, que institui a Política Nacional de Mobilidade Urbana e dá outras providências, para incluir a operação e o disciplinamento do transporte coletivo alternativo de passageiros entre os objetivos que deverão ser observados pelo plano de mobilidade urbana"".";https://www.camara.leg.br/proposicoesWeb/prop_mostrarintegra?codteor=1454914;https://www.camara.leg.br/proposicoesWeb/fichadetramitacao?idProposicao=2083356;Alteração, Lei da Política Nacional de Mobilidade Urbana, inclusão, Plano de Mobilidade Urbana, transporte coletivo, modalidade,  transporte alternativo, passageiro.;Arquivamento - Art.133 do RI;2019-06-26;Arquivada;0.4316;NAO;0.5395
PL 3942/2020;Projeto de Lei;2020-07-27;Marcio Alvino;PL;Altera a Lei nº 9.503, de 1997, que institui o Código de Trânsito Brasileiro, para dispor sobre os limites de peso bruto total da combinação de veículo e unidade acoplada conduzida por condutor habilitado na categoria B.;https://www.camara.leg.br/proposicoesWeb/prop_mostrarintegra?codteor=1916300;https://www.camara.leg.br/proposicoesWeb/fichadetramitacao?idProposicao=2258652;Alteração, Código de Trânsito Brasileiro, limite, peso bruto, total, combinação de veículos, unidade acoplada, condução, categoria de habilitação.;Recebimento;2022-12-15;Tramitando em Conjunto;0.4315;PARCIAL (1 Termo);0.4143
PL 6548/2025;Projeto de Lei;2025-12-18;André Fernandes;PL;Altera a Lei nº 9.503, de 23 de setembro de 1997 (Código de Trânsito Brasileiro), para dispor sobre o uso de telefone celular por motoristas de aplicativo e outros profissionais do transporte remunerado.;https://www.camara.leg.br/proposicoesWeb/prop_mostrarintegra?codteor=3070663;https://www.camara.leg.br/proposicoesWeb/fichadetramitacao?idProposicao=2598549;Alteração, Código de Trânsito Brasileiro (1997), critério, exceção, infração de trânsito, Motorista de aplicativo, Mototaxista, Entregador por aplicativo, utilização, Telefone celular.;Recebimento;2026-02-20;Aguardando Designação de Relator(a);0.4315;PARCIAL (1 Termo);0.4143
PL 3002/2021;Projeto de Lei;2021-08-27;Jéssica Sales;MDB;"""Acresce à lei 9.503, de 23 de setembro de 1997 - Código de Trânsito Brasileiro - o artigo 230-A, para vedar às autoridades e agentes de trânsito a retenção, apreensão ou recolhimento ao pátio de veículos que estejam com o licenciamento anual ou o imposto sobre a propriedade de veículos automotores vencido, e dá outras providências.""";https://www.camara.leg.br/proposicoesWeb/prop_mostrarintegra?codteor=2065510;https://www.camara.leg.br/proposicoesWeb/fichadetramitacao?idProposicao=2296648;Alteração, Código de Trânsito Brasileiro, proibição, autoridade, agente de trânsito, apreensão, recolhimento,  veículo, Licenciamento anual veicular, Imposto sobre a Propriedade de Veículos Automotores (IPVA), vencido.;Apensação;2024-11-11;Tramitando em Conjunto;0.4314;PARCIAL (1 Termo);0.4143
PL 8797/2017;Projeto de Lei;2017-10-05;Daniel Vilela;MDB;Altera a Lei nº 9.503, de 1997, que institui o Código de Trânsito Brasileiro, para dispor sobre os veículos automotores semiautônomos.;https://www.camara.leg.br/proposicoesWeb/prop_mostrarintegra?codteor=1606258;https://www.camara.leg.br/proposicoesWeb/fichadetramitacao?idProposicao=2155204;Alteração, Código de Trânsito Brasileiro, disciplinamento, utilização, veículo semiautônomo, regulamentação,  Conselho Nacional de Trânsito (Contran).;Desarquivamento a Pedido;2019-02-26;Tramitando em Conjunto;0.4314;PARCIAL (1 Termo);0.4143
PL 3569/2024;Projeto de Lei;2024-09-16;Capitão Augusto;PL;Dispõe sobre a proibição do uso de pneus ressolados em veículos de transporte de carga e de passageiros em rodovias federais e estaduais, e dá outras providências.;https://www.camara.leg.br/proposicoesWeb/prop_mostrarintegra?codteor=2477224;https://www.camara.leg.br/proposicoesWeb/fichadetramitacao?idProposicao=2458354;Proibição, pneu usado, reconstrução, pneu, transporte de carga, transporte de passageiro, rodovia federal, rodovia estadual, segurança rodoviária, obrigatoriedade, substituição, penalidade.;Arquivamento;2025-04-15;Arquivada;0.4313;NAO;0.5391
PL 249/2026;Projeto de Lei;2026-02-04;Jonas Donizette;PSB;Altera o art. 306 da Lei nº 9.503, de 23 de setembro de 1997 (Código de Trânsito Brasileiro), para dispor que o crime de condução de veículo automotor com capacidade psicomotora alterada em razão da influência de álcool ou de outra substância psicoativa que determine dependência terá a pena aumentada, se o veículo for de transporte coletivo de passageiros.;https://www.camara.leg.br/proposicoesWeb/prop_mostrarintegra?codteor=3078341;https://www.camara.leg.br/proposicoesWeb/fichadetramitacao?idProposicao=2600741;Alteração, Código de Trânsito Brasileiro (1997), Aumento da pensa, Condução perigosa, Capacidade psicomotora, Veículo automotor, Transporte público coletivo.;Apresentação de Proposição;2026-02-04;;0.4313;PARCIAL (1 Termo);0.4141
PL 1432/2015;Projeto de Lei;2015-05-07;Marcelo Belinati;PP;Acrescenta o § 6º ao art. 147 da Lei nº 9.503, de 23 de setembro de 1997, que instituiu o Código de Trânsito Brasileiro para dispor sobre isenção de taxa de renovação de CNH para motorista de ônibus.;https://www.camara.leg.br/proposicoesWeb/prop_mostrarintegra?codteor=1330568;https://www.camara.leg.br/proposicoesWeb/fichadetramitacao?idProposicao=1230107;Alteração, Código de Trânsito Brasileiro, isenção, taxa, emolumento, renovação, Carteira Nacional de Habilitação (CNH), motorista,  transporte intermunicipal,  transporte urbano,  transporte coletivo.;Desarquivamento a Pedido;2019-02-26;Tramitando em Conjunto;0.4312;PARCIAL (1 Termo);0.4140
PL 1633/2019;Projeto de Lei;2019-03-20;Professor Luizão Goulart;SOLIDARIEDADE;Altera a Lei nº 9.503, de 1997, para isentar o cômputo de pontos no caso de infrações de natureza administrativa ou 	que não comprometam a segurança no trânsito.;https://www.camara.leg.br/proposicoesWeb/prop_mostrarintegra?codteor=1721524;https://www.camara.leg.br/proposicoesWeb/fichadetramitacao?idProposicao=2194832;Alteração, Código de Trânsito Brasileiro, isenção, contagem, pontuação, infração de trânsito, natureza administrativa, ausência, comprometimento, segurança no trânsito.;Arquivamento;2023-02-07;Arquivada;0.4312;PARCIAL (1 Termo);0.4140
PL 6065/2016;Projeto de Lei;2016-08-30;Caetano;PT;Altera a Lei nº 9.503, de 1997, que institui o Código de Trânsito Brasileiro, para excluir os trechos urbanos das rodovias da obrigatoriedade do acendimento dos faróis no período diurno e permitir o uso do farol de rodagem diurna.;https://www.camara.leg.br/proposicoesWeb/prop_mostrarintegra?codteor=1487925;https://www.camara.leg.br/proposicoesWeb/fichadetramitacao?idProposicao=2110227;Alteração, Código de Trânsito Brasileiro, desobrigação, Farol de luz baixa, Via terrestre urbana, utilização, farol de rodagem diurna, rodovia.;Desapensação;2019-12-10;;0.4309;PARCIAL (1 Termo);0.4136
PL 72/2015;Projeto de Lei;2015-02-02;Pompeo de Mattos;PDT;"Permite acesso à Carteira Nacional de Habilitação, categoria ""C"", a motoristas que não tenham cometido infração gravíssima ou reincidido em infração grave.";https://www.camara.leg.br/proposicoesWeb/prop_mostrarintegra?codteor=1296812;https://www.camara.leg.br/proposicoesWeb/fichadetramitacao?idProposicao=944734;Alteração, Código de Trânsito Brasileiro, critérios, concessão, Carteira Nacional de Habilitação (CNH), motorista, transporte de carga, exigência, inexistência, infração gravíssima, reincidência, infração grave.;Arquivamento;2015-11-06;Arquivada;0.4306;PARCIAL (1 Termo);0.4133
PL 2349/2025;Projeto de Lei;2025-05-16;Marcos Tavares;PDT;Cria lei que dispõe sobre a cassação definitiva da Carteira Nacional de Habilitação (CNH) de condutores condenados, com trânsito em julgado, por crimes de assédio sexual ou estupro praticados contra passageiros no exercício da atividade de transporte de pessoas, e altera a Lei nº 9.503, de 23 de setembro de 1997 – Código de Trânsito Brasileiro.;https://www.camara.leg.br/proposicoesWeb/prop_mostrarintegra?codteor=2909408;https://www.camara.leg.br/proposicoesWeb/fichadetramitacao?idProposicao=2509930;Cassação, caráter definitivo, Carteira Nacional de Habilitação (CNH), condutor, veículo automotor, condenação criminal transitada em julgado, crime, assédio sexual, estupro, atividade profissional, transporte de passageiro. _Alteração, Código de Trânsito Brasileiro (1997).;Encerramento de Prazo;2025-09-04;Aguardando Parecer;0.4306;PARCIAL (1 Termo);0.4133
PL 4604/2019;Projeto de Lei;2019-08-20;Luiz Lima;NOVO;Altera a Lei nº 9.503, de 23 de setembro de 1997, que institui o Código de Trânsito Brasileiro, para dispor sobre a circulação de bicicletas e pedestres.;https://www.camara.leg.br/proposicoesWeb/prop_mostrarintegra?codteor=1793732;https://www.camara.leg.br/proposicoesWeb/fichadetramitacao?idProposicao=2216363;Alteração, Código de Trânsito Brasileiro, disciplinamento, trânsito, bicicleta, circulação, via pública, proteção, ciclista.;Publicação de Proposição;2019-09-02;Tramitando em Conjunto;0.4306;PARCIAL (1 Termo);0.4133
