Norma;Descricao da Sigla;Data de Apresentacao;Autor;Partido;Ementa;Link Documento PDF;Link Página Web;Indexacao;Último Estado;Data Último Estado;Situação;Score Final;Boost Keyword;Similaridade Semantica
PL 1499/2015;Projeto de Lei;2015-05-12;Aureo;SOLIDARIEDADE;Dispõe sobre a vistoria de veículos conforme o Código de Trânsito Brasileiro;https://www.camara.leg.br/proposicoesWeb/prop_mostrarintegra?codteor=1333219;https://www.camara.leg.br/proposicoesWeb/fichadetramitacao?idProposicao=1247387;Alteração, Código de Trânsito Brasileiro, critério, vistoria, veículo automotor,  fiscalização, Departamento de Trânsito (Detran).;Desarquivamento a Pedido;2019-02-26;Tramitando em Conjunto;0.4193;PARCIAL (1 Termo);0.3992
PL 37/2019;Projeto de Lei;2019-02-04;Luis Miranda;REPUBLICANOS;Altera a Lei n. 9.503, de 23 de setembro de 1997 - Código de Trânsito Brasileiro, para permitir que o condutor, com 16 anos completo ou mais, possa dirigir acompanhado dos pais ou responsável legal.;https://www.camara.leg.br/proposicoesWeb/prop_mostrarintegra?codteor=1707728;https://www.camara.leg.br/proposicoesWeb/fichadetramitacao?idProposicao=2190477;Alteração, Código de Trânsito Brasileiro, permissão para dirigir, menor de idade, crime de trânsito, aplicação, Estatuto da Criança e do Adolescente (ECA).;Notificação de Despacho;2019-08-29;Tramitando em Conjunto;0.4190;PARCIAL (1 Termo);0.3988
PL 11236/2018;Projeto de Lei;2018-12-19;Celso Maldaner;MDB;Dispõe sobre a renovação da frota de veículos de transporte rodoviário de cargas de propriedade de transportadores autônomos de carga.;https://www.camara.leg.br/proposicoesWeb/prop_mostrarintegra?codteor=1702386;https://www.camara.leg.br/proposicoesWeb/fichadetramitacao?idProposicao=2190015;Concessão, linha de crédito, renovação, frota, veículo, transporte rodoviário, transporte de carga, Transportador Autônomo de Cargas (TAC), cooperativa de transporte, Empresa de Transporte Rodoviário de Cargas (ETC), microempresa, pequena empresa, microempreendedor, logística reversa, veículo inservível, retirada, circulação, criação, Contribuição de Intervenção no Domínio Econômico sobre a comercialização, pelos empreendimentos integrantes do sistema de logística reversa, de bens de consumo e intermediários obtidos mediante a reciclagem, o reaproveitamento ou a reutilização de materiais, partes, peças, sucatas e resíduos de veículos inservíveis ou em fim de vida útil (Cide-Log),  tributação.;Recebimento;2023-08-30;Tramitando em Conjunto;0.4190;NAO;0.5238
PL 3408/2023;Projeto de Lei;2023-07-05;Cobalchini;MDB;Altera a Lei nº 9.503, de 23 de setembro de 1997, Código de Trânsito Brasileiro, para dispor sobre a destinação de recursos arrecadados com multas para custeio do processo de habilitação de condutores de baixa renda.;https://www.camara.leg.br/proposicoesWeb/prop_mostrarintegra?codteor=2296961;https://www.camara.leg.br/proposicoesWeb/fichadetramitacao?idProposicao=2372723;Alteração, Código de Trânsito Brasileiro (1997), destinação, Recursos financeiros, arrecadação, Multa, Formação de condutor, População de baixa renda, Carteira Nacional de Habilitação (CNH).;Apresentação de Requerimento;2024-04-08;Tramitando em Conjunto;0.4186;PARCIAL (1 Termo);0.3982
PL 7295/2017;Projeto de Lei;2017-04-04;Cabo Sabino;AVANTE;Acrescenta dispositivo na Lei 12.587, de 03 de janeiro de 2012, para dispor sobre a prestação de serviço remunerado de transporte de passageiros por intermédio de aplicativo ou de qualquer serviço tecnológico;https://www.camara.leg.br/proposicoesWeb/prop_mostrarintegra?codteor=1542066;https://www.camara.leg.br/proposicoesWeb/fichadetramitacao?idProposicao=2128146;Alteração, Lei da Política Nacional de Mobilidade Urbana, transporte remunerado, transporte de passageiro, software aplicativo, aplicativo Uber, regulamentação, poder público, poder concedente.;Arquivamento;2017-12-06;Arquivada;0.4184;NAO;0.5230
PL 1745/2025;Projeto de Lei;2025-04-16;Fred Linhares;REPUBLICANOS;Altera a Lei nº 9.503, de 23 de setembro de 1997, que institui o Código de Trânsito Brasileiro (CTB), para dispor sobre os requisitos mínimos e específicos para condução de veículos e motocicletas de alta potência;https://www.camara.leg.br/proposicoesWeb/prop_mostrarintegra?codteor=2888106;https://www.camara.leg.br/proposicoesWeb/fichadetramitacao?idProposicao=2498315;Alteração, Código de Trânsito Brasileiro (1997), requisito, Condução de veículo, motocicleta, potência, alto desempenho, descumprimento, Infração de trânsito.;Encerramento de Prazo;2025-09-04;Aguardando Parecer;0.4183;PARCIAL (1 Termo);0.3979
PL 3809/2021;Projeto de Lei;2021-10-28;Efraim Filho;UNIÃO;Dá nome a viadutos da BR-230, travessia urbana de Cabedelo - PB.;https://www.camara.leg.br/proposicoesWeb/prop_mostrarintegra?codteor=2097285;https://www.camara.leg.br/proposicoesWeb/fichadetramitacao?idProposicao=2304945;Denominação, viaduto, rodovia federal, travessia, Cabedelo (PB), Paraíba, homenagem, deputado federal, ex-governador. _Homenagem, médico, vice-prefeito. _Homenagem póstuma, estrangeiro, colaborador, desenvolvimento regional.;Designação de Relator(a);2025-04-22;Aguardando Parecer;0.4182;NAO;0.5228
PL 608/2024;Projeto de Lei;2024-03-06;Marco Brasil;PP;Esta Lei dispõe sobre a obrigatoriedade de criação de recuos em rodovias federais desprovidas de acostamento.;https://www.camara.leg.br/proposicoesWeb/prop_mostrarintegra?codteor=2392097;https://www.camara.leg.br/proposicoesWeb/fichadetramitacao?idProposicao=2419616;Obrigatoriedade, criação, acostamento, Pista de rolamento, rodovia federal, Segurança viária.;Notificações;2024-05-29;Tramitando em Conjunto;0.4182;NAO;0.5228
PL 3120/2024;Projeto de Lei;2024-08-13;Jorge Goetten;REPUBLICANOS;Altera a Lei nº 13.103, de 2 de março de 2015, para permitir a utilização de depósitos de veículos recolhidos públicos da Polícia Rodoviária Federal como pontos de parada e descanso dos motoristas profissionais de transporte rodoviário de passageiros e rodoviário de cargas.;https://www.camara.leg.br/proposicoesWeb/prop_mostrarintegra?codteor=2463192;https://www.camara.leg.br/proposicoesWeb/fichadetramitacao?idProposicao=2452063;Alteração, Lei do Caminhoneiro (2015), utilização, depósito de veículos, Polícia Rodoviária Federal (PRF), ponto de parada, repouso, motorista profissional, Transporte rodoviário, Tranporte de carga, motorista de ônibus, motorista de caminhão.;Publicação de Proposição;2024-08-21;Aguardando Encaminhamento;0.4179;NAO;0.5224
PL 1321/2023;Projeto de Lei;2023-03-22;Any Ortiz;CIDADANIA;Altera a Lei nº 10.209, de 23 de março de 2001, que “institui o Vale-Pedágio obrigatório sobre transporte rodoviário de carga e dá outras providências”.;https://www.camara.leg.br/proposicoesWeb/prop_mostrarintegra?codteor=2247154;https://www.camara.leg.br/proposicoesWeb/fichadetramitacao?idProposicao=2352451;Alteração, Lei Federal, critério, pagamento, Vale-Pedágio, Transporte de carga _ Redução, multa administrativa, indenização, embarcador, Empresa de transporte.;Devolução ao(à) Relator(a);2025-09-08;Aguardando Parecer;0.4176;NAO;0.5220
PL 1862/2021;Projeto de Lei;2024-11-27;Senado Federal - Jorginho Mello;N/A;Altera a Lei nº 9.503, de 23 de setembro de 1997 (Código de Trânsito Brasileiro), para possibilitar a concessão de autorização especial de trânsito aos veículos e demais equipamentos automotores, e às suas combinações, nas condições que especifica.;https://www.camara.leg.br/proposicoesWeb/prop_mostrarintegra?codteor=2828328;https://www.camara.leg.br/proposicoesWeb/fichadetramitacao?idProposicao=2472875;Alteração, Código de Trânsito Brasileiro (1997), Autorização Especial de Trânsito (AET), tráfego, veículo, desacordo, limite, peso, dimensão, prazo determinado, medida de segurança.;Recebimento;2025-06-12;Aguardando Designação de Relator(a);0.4175;PARCIAL (1 Termo);0.3968
PL 6014/2016;Projeto de Lei;2016-08-22;Soraya Santos;PL;"Dispõe sobre a concessão de anistia aos condutores penalizados com a aplicação da Lei nº 13.290, de 23 de maio de 2016, que altera o inciso I do art. 40 e a alínea b do inciso I do art. 250 da Lei nº 9.503, de 23 de setembro de 1997 - Código de Trânsito Brasileiro; no período de doze meses, contados da data de publicação desta lei.";https://www.camara.leg.br/proposicoesWeb/prop_mostrarintegra?codteor=1485297;https://www.camara.leg.br/proposicoesWeb/fichadetramitacao?idProposicao=2094969;Concessão, anistia, multa de trânsito, ausência, utilização, farol de luz baixa, dia.;Desapensação;2018-02-07;Arquivada;0.4175;PARCIAL (1 Termo);0.3968
PL 1239/2015;Projeto de Lei;2015-04-23;Marcos Rotta;MDB;Altera o § 2º do art. 302 da Lei nº 9.503/97 (Código de Trânsito), para prever a prática de homicídio doloso na direção de veículo automotor, se o agente conduzir veículo automotor com capacidade psicomotora alterada em razão da influência de álcool ou de outra substância psicoativa que determine dependência ou participar, em via, de corrida, disputa ou competição automobilística ou ainda de exibição ou demonstração de perícia em manobra de veículo automotor, não autorizada pela autoridade competente, acrescenta o inciso IX no artigo 1º na Lei 8.072/90, para incluir essa modalidade no rol de crimes hediondos.;https://www.camara.leg.br/proposicoesWeb/prop_mostrarintegra?codteor=1324080;https://www.camara.leg.br/proposicoesWeb/fichadetramitacao?idProposicao=1215271;Alteração, Código de Trânsito Brasileiro, tipicidade penal, homicídio doloso, motorista, condução sob efeito de álcool, condução sob efeito de substância psicoativa, pega, via pública. _Alteração, Lei dos Crimes Hediondos, tipicidade penal, crime hediondo, homicídio doloso, motorista, condução sob efeito de álcool, condução sob efeito de substância psicoativa, disputa automobilística ilegal, via pública.;Apensação;2025-11-06;Tramitando em Conjunto;0.4173;PARCIAL (1 Termo);0.3967
PL 7787/2017;Projeto de Lei;2017-06-06;Fausto Pinato;PP;Altera a Lei nº 9.503, de 23 de setembro de 1997, para dispor sobre a formação do condutor.;https://www.camara.leg.br/proposicoesWeb/prop_mostrarintegra?codteor=1566506;https://www.camara.leg.br/proposicoesWeb/fichadetramitacao?idProposicao=2140311;Alteração, Código de Trânsito Brasileiro, formação de condutor, veículo terrestre, critério, condução defensiva.;Desarquivamento a Pedido;2019-02-20;Aguardando Designação de Relator(a);0.4173;PARCIAL (1 Termo);0.3966
PL 4994/2023;Projeto de Lei;2023-10-16;Adail Filho;REPUBLICANOS;Reconhece a rodovia BR-319-RO/AM como infraestrutura crítica, indispensável à segurança nacional e estabelece a garantia de sua trafegabilidade nas condições que especifica.;https://www.camara.leg.br/proposicoesWeb/prop_mostrarintegra?codteor=2344825;https://www.camara.leg.br/proposicoesWeb/fichadetramitacao?idProposicao=2395883;Reconhecimento, rodovia federal, infraestrutura crítica, interesse, segurança nacional, obrigatoriedade, garantia, trafegabilidade, caráter permanente. _Atos, liberação, licenciamento, poluente, relação, procedimento. _Proibição, construção, ligação, anexo, rodovia. _Enquadramento, infraestrutura, prioridade, Plano Nacional de Desenvolvimento (PND). _Autorização, União, recebimento, doação, realização, atividade, recursos não reembolsáveis, conservação, uso sustentável, Amazônia Legal. _Alteração, Lei Federal, rodovia federal, integrante, Rede de Integração Nacional (RINTER), consideração, prioridade, obtenção, licença, recursos, pavimentação, construção, infraestrutura.;Expedição de Documento;2023-12-20;Aguardando Apreciação pelo Senado Federal;0.4173;NAO;0.5216
PL 3065/2022;Projeto de Lei;2022-12-21;Abou Anni;UNIÃO;Altera a Lei nº 9.503, de 23 de setembro de 1997, que institui o Código de Trânsito Brasileiro, para dispor sobre a formação do agente da autoridade de trânsito competente para a lavratura de auto de infração.;https://www.camara.leg.br/proposicoesWeb/prop_mostrarintegra?codteor=2227971;https://www.camara.leg.br/proposicoesWeb/fichadetramitacao?idProposicao=2345193;Alteração, Código de Trânsito Brasileiro, obrigatoriedade, Agente de trânsito, Curso de formação, atualização, lavratura, auto de infração.;Publicação de Proposição;2023-03-15;Tramitando em Conjunto;0.4170;PARCIAL (1 Termo);0.3963
PL 1689/2025;Projeto de Lei;2025-04-14;Alex Manente;CIDADANIA;Dispõe sobre cadastro de motoristas e usuários de aplicativos de transporte, dos impedimentos para figurar como motorista e altera o art. 92 do Decreto-Lei Nº 2.848, de 7 de dezembro de 1940 (Código Penal).;https://www.camara.leg.br/proposicoesWeb/prop_mostrarintegra?codteor=2886782;https://www.camara.leg.br/proposicoesWeb/fichadetramitacao?idProposicao=2497758;Obrigatoriedade, Plataforma digital, Transporte por aplicativo, exigência, Antecedente criminal, cadastro, motorista. _ Alteração, Código Penal (1940), Efeito da condenação, proibição, atuação, motorista de aplicativo, condenado, violência doméstica, mulher, criança, adolescente, idoso, Crime contra a dignidade sexual.;Recebimento;2025-12-19;Aguardando Designação de Relator(a);0.4169;NAO;0.5211
PL 10551/2018;Projeto de Lei;2018-07-10;Hugo Leal;PSD;Altera a Lei nº 9.503, de 23 de setembro de 1997, que institui o Código de Trânsito Brasileiro, para possibilitar a realização de curso preventivo de reciclagem por todos os condutores que exercem atividade remunerada em veículo.;https://www.camara.leg.br/proposicoesWeb/prop_mostrarintegra?codteor=1675690;https://www.camara.leg.br/proposicoesWeb/fichadetramitacao?idProposicao=2181401;Alteração, Código de Trânsito Brasileiro, penalidade, suspensão, direito de dirigir, motorista, atividade remunerada, veículo, opção, curso de reciclagem, trânsito.;Encerramento de Prazo;2021-03-24;Aguardando Designação de Relator(a);0.4168;PARCIAL (1 Termo);0.3960
PL 4433/2016;Projeto de Lei;2016-02-18;Átila A. Nunes;MDB;DISPÕE SOBRE A ISENÇÃO DO PAGAMENTO DE PEDÁGIO NAS RODOVIAS FEDERAIS AOS AUTOMÓVEIS DE PROPRIEDADE DE PESSOAS PORTADORAS DE DEFICIÊNCIA FÍSICA.;https://www.camara.leg.br/proposicoesWeb/prop_mostrarintegra?codteor=1434156;https://www.camara.leg.br/proposicoesWeb/fichadetramitacao?idProposicao=2077522;Isenção, pagamento, pedágio, rodovia federal, pessoa com deficiência física, fixação, critério.;Desarquivamento a Pedido;2019-02-22;Tramitando em Conjunto;0.4165;NAO;0.5206
PL 1590/2020;Projeto de Lei;2020-04-06;Senado Federal - Randolfe Rodrigues;N/A;Altera a Lei n° 9.503, de 23 de setembro de 1997 (Código de Trânsito Brasileiro), para determinar que sejam disponibilizadas na internet as informações constantes do Renach e do Renavam aos motoristas habilitados e aos proprietários de veículo, respectivamente.;https://www.camara.leg.br/proposicoesWeb/prop_mostrarintegra?codteor=1873519;https://www.camara.leg.br/proposicoesWeb/fichadetramitacao?idProposicao=2243124;Alteração, Código de Trânsito Brasileiro, informação, Registro Nacional de Carteira de Habilitação (RENACH), Registro Nacional de Veículos Automotores (RENAVAM), Internet, consulta,  motorista, proprietário, veículo automotor.;Apresentação de Proposição;2024-06-25;Transformado em Norma Jurídica;0.4160;PARCIAL (1 Termo);0.3951
PL 1889/2015;Projeto de Lei;2015-06-11;Danrlei de Deus Hinterholz;PSD;"Altera a Lei nº 12.587, de 3 de janeiro de 2012, que ""institui as diretrizes da Política Nacional de Mobilidade Urbana"", para estabelecer que no mínimo de 3% da frota de táxis sejam adaptados às pessoas com deficiência.";https://www.camara.leg.br/proposicoesWeb/prop_mostrarintegra?codteor=1347541;https://www.camara.leg.br/proposicoesWeb/fichadetramitacao?idProposicao=1306948;Alteração, lei federal,  percentual mínimo, frota, táxi, município, adaptação, pessoa com deficiência.;Notificações;2024-09-13;Tramitando em Conjunto;0.4160;NAO;0.5199
PL 9515/2018;Projeto de Lei;2018-02-07;Marco Maia;PT;Dispõe sobre a política de reajustes nas tarifas do transporte público em todo o território nacional;https://www.camara.leg.br/proposicoesWeb/prop_mostrarintegra?codteor=1639491;https://www.camara.leg.br/proposicoesWeb/fichadetramitacao?idProposicao=2167792;Reajuste de tarifas, Transporte público,  limite, Índice Nacional de Preços ao Consumidor Amplo (IPCA).;Desarquivamento a Pedido;2019-02-26;Tramitando em Conjunto;0.4158;NAO;0.5198
PL 5417/2016;Projeto de Lei;2016-05-31;Ronaldo Martins;REPUBLICANOS;Acrescenta os artigos 103-A e 136-A e altera o inciso II do art. 230 da Lei nº. 9.503, de 23 de setembro de 1997, para dispor sobre o transporte de passageiros em compartimento de carga, vedando o uso como transporte de escolares, na forma que indica.;https://www.camara.leg.br/proposicoesWeb/prop_mostrarintegra?codteor=1462400;https://www.camara.leg.br/proposicoesWeb/fichadetramitacao?idProposicao=2086016;Alteração, Código de Trânsito Brasileiro, disciplinamento, transporte de passageiro, veículo de carga, utilitário, proibição, utilização, transporte escolar.;Notificação de Apensação;2021-11-23;Tramitando em Conjunto;0.4158;PARCIAL (1 Termo);0.3948
PLP 233/2023;Projeto de Lei Complementar;2023-10-31;Poder Executivo;N/A;"Dispõe sobre o Seguro Obrigatório para Proteção de Vítimas de Acidentes de Trânsito e altera o Decreto-Lei nº 73, de 21 de novembro de 1966, que dispõe sobre o Sistema Nacional de Seguros Privados. 


NOVA EMENTA: Dispõe sobre o Seguro Obrigatório para Proteção de Vítimas de Acidentes de Trânsito (SPVAT); altera o Decreto-Lei nº 73, de 21 de novembro de 1966, as Leis nºs 8.212, de 24 de julho de 1991, 9.503, de 23 de setembro de 1997 (Código de Trânsito Brasileiro), e 14.075, de 22 de outubro de 2020, e a Lei Complementar nº 200, de 30 de agosto de 2023; e revoga as Leis nºs 6.194, de 19 de dezembro de 1974, e 8.441, de 13 de julho de 1992, e dispositivos das Leis nºs 8.374, de 30 de dezembro de 1991, 11.482, de 31 de maio de 2007, e 11.945, de 4 de junho de 2009.";https://www.camara.leg.br/proposicoesWeb/prop_mostrarintegra?codteor=2354107;https://www.camara.leg.br/proposicoesWeb/fichadetramitacao?idProposicao=2400758;Criação, Seguro Obrigatório para Proteção de Vítimas de Acidentes de Trânsito (Seguro SPVAT), indenização, dano pessoal, vítima, Acidente de trânsito, diretrizes. _ Alteração, Lei do Seguro Privado (1996), Código de Trânsito Brasileiro (1997), repasse, percentual, prêmio, Seguro Obrigatório para Proteção de Vítimas de Acidentes de Trânsito (Seguro SPVAT), Seguridade social, Sistema Único de Saúde (SUS), Assistência médico-hospitalar, vítima, acidente de trânsito, Sistema Nacional de Trânsito, Programa (administração), prevenção, Sinistro.;Apresentação de Proposição;2024-06-11;Transformado em Norma Jurídica;0.4155;PARCIAL (1 Termo);0.3944
PL 5689/2025;Projeto de Lei;2025-11-05;Capitão Alden;PL;Altera a Lei nº 9.503, de 1997, Código de Trânsito Brasileiro, e o Decreto-Lei nº 2.848, de 1940 (Código Penal), para agravar as penalidades administrativas e criminais decorrentes da condução de veículo automotor com a placa de identificação violada, falsificada ou sem condições de legibilidade e visibilidade.;https://www.camara.leg.br/proposicoesWeb/prop_mostrarintegra?codteor=3040079;https://www.camara.leg.br/proposicoesWeb/fichadetramitacao?idProposicao=2581938;Alteração, Código de Trânsito Brasileiro (1997), Código Penal (1940), Adulteração de sinal identificador de veículo automotor, Falsidade (crime), agravamento, Penalidade administrativa, Agravação penal, Condução de veículo, adulteração, falsificação, Placa de identificação de veículo automotor, dificuldade, visibilidade, legibilidade.;Recebimento;2025-12-05;Aguardando Designação de Relator(a);0.4155;PARCIAL (1 Termo);0.3943
PL 4301/2024;Projeto de Lei;2024-11-08;Rafael Brito;MDB;Dispõe sobre o transporte público gratuito no Dia dos Finados em todo o território nacional e dá outras providências.;https://www.camara.leg.br/proposicoesWeb/prop_mostrarintegra?codteor=2817788;https://www.camara.leg.br/proposicoesWeb/fichadetramitacao?idProposicao=2467639;Gratuidade, Transporte público, Dia de Finados, novembro.;Designação de Relator(a);2025-08-22;Aguardando Parecer;0.4151;NAO;0.5189
PL 4092/2024;Projeto de Lei;2024-10-25;Marcos Tavares;PDT;Institui o “Passe Livre Transplantado” nos Sistemas de Transporte Público Interestadual, Municipal e Semiurbano de Passageiros, e concede isenções tributárias para pessoas que passaram por procedimento de transplante de órgãos.;https://www.camara.leg.br/proposicoesWeb/prop_mostrarintegra?codteor=2490869;https://www.camara.leg.br/proposicoesWeb/fichadetramitacao?idProposicao=2464727;Passe Livre, benefício fiscal, isenção tributária, Imposto sobre Produtos Industrializados (IPI),  Imposto sobre Operações relativas à Circulação de Mercadorias e sobre Prestações de Serviços de Transporte Interestadual e Intermunicipal e de Comunicação (ICMS), Imposto sobre a Propriedade de Veículos Automotores (IPVA), Imposto sobre Operações de Crédito, Câmbio e Seguro ou Relativas a Títulos ou Valores Mobiliários (IOF), paciente transplantado, gratuidade, transporte público coletivo, transplante de órgão ou tecido, critério, beneficiário, diretrizes.;Devolução à CCP;2025-04-03;Aguardando Encaminhamento;0.4151;NAO;0.5189
PL 6745/2016;Projeto de Lei;2016-12-15;Felipe Bornier;PROS;Obriga os órgãos de trânsito a notificar, semestralmente, os proprietários de veículos quanto à pontuação em infrações.;https://www.camara.leg.br/proposicoesWeb/prop_mostrarintegra?codteor=1518170;https://www.camara.leg.br/proposicoesWeb/fichadetramitacao?idProposicao=2121557;Alteração, Código de Trânsito Brasileiro, proprietário, veículo terrestre, notificação eletrônica, notificação postal, infração de trânsito, semestre.;Arquivamento;2019-01-31;Arquivada;0.4148;PARCIAL (1 Termo);0.3935
PEC 22/2025;Proposta de Emenda à Constituição;2026-02-26;Senado Federal - Jaime Bagattoli;N/A;Acrescenta os arts. 139 e 140 ao Ato das Disposições Constitucionais Transitórias (ADCT), para instituir a Política Nacional de Apoio à Atividade de Transporte Rodoviário Profissional e dispor sobre o intervalo para repouso do motorista profissional.;https://www.camara.leg.br/proposicoesWeb/prop_mostrarintegra?codteor=3089600;https://www.camara.leg.br/proposicoesWeb/fichadetramitacao?idProposicao=2605334;;Recebimento;2026-02-27;;0.4147;NAO;0.5184
PL 5570/2016;Projeto de Lei;2016-06-14;Felipe Bornier;PROS;Dispõe sobre a retirada de veículos abandonados nas vias públicas.;https://www.camara.leg.br/proposicoesWeb/prop_mostrarintegra?codteor=1467874;https://www.camara.leg.br/proposicoesWeb/fichadetramitacao?idProposicao=2088028;Regulamentação, remoção de veículo, abandono, via pública, competência, agente de trânsito, policial militar, guarda municipal, agente, vigilância sanitária.;Notificacao para Publicação Intermediária;2025-12-02;Tramitando em Conjunto;0.4147;PARCIAL (1 Termo);0.3934
PL 7526/2017;Projeto de Lei;2017-04-27;Cleber Verde;MDB;Altera o § 3º ao art. 4º da Lei nº 6.194, de 19 de dezembro de 1974, que dispõe sobre Seguro Obrigatório de Danos Pessoais causados por veículos automotores de via terrestre, ou por sua carga, a pessoas transportadas ou não;https://www.camara.leg.br/proposicoesWeb/prop_mostrarintegra?codteor=1550804;https://www.camara.leg.br/proposicoesWeb/fichadetramitacao?idProposicao=2132672;Alteração, Lei do DPVAT, pagamento, Seguro Obrigatório de Danos Pessoais Causados por Veículos Automotores de Vias Terrestres (Seguro DPVAT), sucessor (direito civil), vítima, invalidez permanente.;Notificação de Apensação;2019-05-16;Tramitando em Conjunto;0.4146;NAO;0.5182
PL 3230/2023;Projeto de Lei;2023-06-22;Carol Dartora;PT;Altera a Lei nº 12.587, de 03 de janeiro de 2012, para obrigar os modais de transporte que compõem o Sistema Nacional de Mobilidade Urbana a adotar mecanismos de informação aos usuários sobre condutas de discriminação racial, etária, capacitista e crimes contra a dignidade sexual.;https://www.camara.leg.br/proposicoesWeb/prop_mostrarintegra?codteor=2292580;https://www.camara.leg.br/proposicoesWeb/fichadetramitacao?idProposicao=2371151;Alteração, Lei da Política Nacional de Mobilidade Urbana, direitos, usuário, Sistema Nacional de Mobilidade Urbana, segurança, interior, modal de transporte, ausência, preconceito, assédio sexual, fixação, placa, nota informativa, educativo, respeito, diversidade, pluralidade, dignidade sexual. _Penalização, ato discriminatório, crime contra a dignidade sexual.;Publicação de Proposição;2025-08-29;Aguardando Designação de Relator(a);0.4145;NAO;0.5181
